{
  "version": "1.0",
  "id": "lawo-crystal-tabletop-light",
  "name": "crystal Tabletop Light",
  "manufacturerId": "lawo",
  "orderCode": null,
  "orderNumber": "715/30-10",
  "climateLoad": 40,
  "rackType": "NONE",
  "portTypes": [
    {
      "name": "ETHERNET",
      "direction": "UP",
      "connectorId": "RJ45_f",
      "compatibleSignalTypes": ["100BASE_TX"]
    },
    {
      "name": "CAN A",
      "direction": "BIDI",
      "connectorId": "RJ45_f",
      "compatibleSignalTypes": ["CAN_1M"]
    },
    {
      "name": "CAN B",
      "direction": "BIDI",
      "connectorId": "RJ45_f",
      "compatibleSignalTypes": ["CAN_500K"]
    }
  ],
  "moduleSlotTypes": [
    {
      "name": "",
      "compatibleModuleSlotFormFactors": [],
      "compatibleModuleTypes": [
        "lawo-crystal-fader-module-light",
        "lawo-crystal-main-module-light"
      ],
      "incompatibleModuleTypes": []
    }
  ]
}
